id,name,url,preview_ingredients,ingredients,steps,combined_text,image_path
479045,肉末茄子,https://icook.tw/recipes/479045,茄子、瘦豬絞肉、米酒、蔥、醬油、大蒜、白胡椒、九層塔、蠔油、糖,茄子4條 | 瘦豬絞肉200克 | 蔥2根 | 大蒜5瓣 | 九層塔1把 | 米酒1大匙 | 醬油2大匙 | 白胡椒1小匙 | 蠔油1大匙 | 糖1大匙,"備料茄子一開四蔥切丁分蔥白蔥綠九層塔摘葉
大蒜切丁 | 熱鍋熱油茄子皮朝下擺入茄子太多可以分兩批 皮上色後取出 | 下豬肉 炒至半熟 | 下蔥白蒜末 然後要把水分炒乾 | 下調味料 依序下 米酒 醬油 糖 蠔油 白胡椒 | 加入茄子拌炒一分鐘 | 下青蔥跟九層塔半炒 | 好吃肉末茄子就完成了！","肉末茄子。食材：茄子4條，瘦豬絞肉200克，蔥2根，大蒜5瓣，九層塔1把，米酒1大匙，醬油2大匙，白胡椒1小匙，蠔油1大匙，糖1大匙。做法：備料茄子一開四蔥切丁分蔥白蔥綠九層塔摘葉
大蒜切丁，熱鍋熱油茄子皮朝下擺入茄子太多可以分兩批 皮上色後取出，下豬肉 炒至半熟，下蔥白蒜末 然後要把水分炒乾，下調味料 依序下 米酒 醬油 糖 蠔油 白胡椒，加入茄子拌炒一分鐘，下青蔥跟九層塔半炒，好吃肉末茄子就完成了！。",茄子/479045_肉末茄子.jpg
478488,炒茄子,https://icook.tw/recipes/478488,茄子（圓形）、九層塔、蒜頭、香菇素蠔油、白醋、香油、糖、米酒頭、味醂,茄子（圓形）3顆 | 九層塔適量 | 蒜頭適量 | 香菇素蠔油適量 | 白醋一小匙 | 香油少許 | 糖少許 | 米酒頭少許 | 味醂少許,茄子去頭清洗乾淨切成塊狀，備用。 | 九層塔清洗乾淨取葉子。 | 蒜頭用刀子拍一下，撥開外皮切成蒜末。 | 鍋子先熱鍋，倒入油先爆香蒜頭放入茄子拌炒。 | 加入清水，倒入適量的香菇素蠔油、少許香油、味醂、糖和一小匙白醋，最後倒入少許的米酒頭拌炒均勻，等食材全部熟後完成。,炒茄子。食材：茄子（圓形）3顆，九層塔適量，蒜頭適量，香菇素蠔油適量，白醋一小匙，香油少許，糖少許，米酒頭少許，味醂少許。做法：茄子去頭清洗乾淨切成塊狀，備用。，九層塔清洗乾淨取葉子。，蒜頭用刀子拍一下，撥開外皮切成蒜末。，鍋子先熱鍋，倒入油先爆香蒜頭放入茄子拌炒。，加入清水，倒入適量的香菇素蠔油、少許香油、味醂、糖和一小匙白醋，最後倒入少許的米酒頭拌炒均勻，等食材全部熟後完成。。,茄子/478488_炒茄子.jpg
477313,醬燒茄子,https://icook.tw/recipes/477313,茄子、醬油、醬油膏、味霖、鹽巴,茄子1條 | 醬油2湯匙 | 醬油膏1湯匙 | 味霖2湯匙 | 鹽巴少許,"把茄子去頭，切斷後再對切！
我把皮的部分再斜切，但也可以不要喔！ | 兩面煎到焦黃！ | 放醬汁蓋蓋子讓他悶煮一下！（也可以另外勾芡，讓醬汁巴在茄子上喔！）
就可以起鍋！非常好吃！","醬燒茄子。食材：茄子1條，醬油2湯匙，醬油膏1湯匙，味霖2湯匙，鹽巴少許。做法：把茄子去頭，切斷後再對切！
我把皮的部分再斜切，但也可以不要喔！，兩面煎到焦黃！，放醬汁蓋蓋子讓他悶煮一下！（也可以另外勾芡，讓醬汁巴在茄子上喔！）
就可以起鍋！非常好吃！。",茄子/477313_醬燒茄子.jpg
479378,清蒸茄子(純素),https://icook.tw/recipes/479378,茄子,茄子2條,"香菜辣椒醬作法請見https: | icook.tw | recipes | 479278 | 1.鍋中擺入一個蒸盤，然後將水燒至大滾
2.茄子洗淨，切成大塊，碼放盤中【盡量攤開，不要重疊】 | 戴上手套，將茄子放上蒸盤【小心被蒸氣燙傷】 | 大火蒸5分鐘即可取出 | 可以搭配薑泥+烏醋，或是香菜辣椒醬享用","清蒸茄子(純素)。食材：茄子2條。做法：香菜辣椒醬作法請見https:，icook.tw，recipes，479278，1.鍋中擺入一個蒸盤，然後將水燒至大滾
2.茄子洗淨，切成大塊，碼放盤中【盡量攤開，不要重疊】，戴上手套，將茄子放上蒸盤【小心被蒸氣燙傷】，大火蒸5分鐘即可取出，可以搭配薑泥+烏醋，或是香菜辣椒醬享用。",茄子/479378_清蒸茄子(純素).jpg
474067,涼拌茄子,https://icook.tw/recipes/474067,茄子、蒜頭、九層塔或香菜、辣椒、糖、烏醋、醬油、水、香油、白醋（避免茄子氧化用）,茄子3條 | 蒜頭3瓣 | 九層塔或香菜1把 | 辣椒1小條 | 糖1茶匙 | 烏醋1大匙 | 醬油2大匙 | 水1大匙 | 香油1小匙 | 白醋（避免茄子氧化用）1小匙,茄子切段（或再直剖切開），在滾水中滴幾滴白醋，儘量將茄子壓入水面下煮，可以避免氧化維持漂亮的紫色，蓋鍋蓋約煮3分鐘。 | 茄子撈起後泡冰水，此時準備醬料，將所有材料切末拌勻，淋在茄子上即可享用 | 可以一次多做一些，夏日炎熱不開伙，直接從冰箱取出即可食用,涼拌茄子。食材：茄子3條，蒜頭3瓣，九層塔或香菜1把，辣椒1小條，糖1茶匙，烏醋1大匙，醬油2大匙，水1大匙，香油1小匙，白醋（避免茄子氧化用）1小匙。做法：茄子切段（或再直剖切開），在滾水中滴幾滴白醋，儘量將茄子壓入水面下煮，可以避免氧化維持漂亮的紫色，蓋鍋蓋約煮3分鐘。，茄子撈起後泡冰水，此時準備醬料，將所有材料切末拌勻，淋在茄子上即可享用，可以一次多做一些，夏日炎熱不開伙，直接從冰箱取出即可食用。,茄子/474067_涼拌茄子.jpg
478439,三杯茄子寶寶粥,https://icook.tw/recipes/478439,茄子切段、冷凍玉米粒無鹽、九層塔葉、絞肉豬,茄子切段1根 | 冷凍玉米粒無鹽5大匙 | 九層塔葉4葉 | 絞肉豬500克,橄欖油炒香豬絞肉 | 剩下食材一起丟進去，加半杯馬克杯的水，稍微悶一下 | 最後將九層塔再丟進去 這樣就完成了 | 將煮好的這些，果汁機打成泥，與好的白飯（偏軟）一起拌勻，之後盛起來即可,三杯茄子寶寶粥。食材：茄子切段1根，冷凍玉米粒無鹽5大匙，九層塔葉4葉，絞肉豬500克。做法：橄欖油炒香豬絞肉，剩下食材一起丟進去，加半杯馬克杯的水，稍微悶一下，最後將九層塔再丟進去 這樣就完成了，將煮好的這些，果汁機打成泥，與好的白飯（偏軟）一起拌勻，之後盛起來即可。,茄子/478439_三杯茄子寶寶粥.jpg
462261,茄子蛋包豆腐,https://icook.tw/recipes/462261,板豆腐、茄子、豆瓣醬、雞蛋、雞粉、糖、醬油,板豆腐1塊 | 茄子1條 | 雞蛋4顆 | 豆瓣醬1大匙 | 雞粉1茶匙 | 糖1小匙 | 醬油1大匙,將板豆腐切丁、茄子切成小塊狀，泡水備用 | 起油鍋將板豆腐煎至兩面金黃， | 將豆瓣醬、醬油、雞粉、糖、適量的水拌勻後加入豆腐中煮熟 | 加入茄子塊翻炒至熟透，打散雞蛋後倒入煮熟的豆腐和茄子中即完成,茄子蛋包豆腐。食材：板豆腐1塊，茄子1條，雞蛋4顆，豆瓣醬1大匙，雞粉1茶匙，糖1小匙，醬油1大匙。做法：將板豆腐切丁、茄子切成小塊狀，泡水備用，起油鍋將板豆腐煎至兩面金黃，，將豆瓣醬、醬油、雞粉、糖、適量的水拌勻後加入豆腐中煮熟，加入茄子塊翻炒至熟透，打散雞蛋後倒入煮熟的豆腐和茄子中即完成。,茄子/462261_茄子蛋包豆腐.jpg
471538,煙燻肉桂茄子咖哩,https://icook.tw/recipes/471538,黑芥末子、孜然、洋蔥、大蒜、肉豆蔻粉、茄子、鷹嘴豆罐頭、醋、水、雞湯塊、肉桂棒、鹽,黑芥末子1小匙 | 孜然1小匙 | 洋蔥1顆 | 大蒜4瓣 | 肉豆蔻粉1/2小匙 | 茄子2根 | 鷹嘴豆罐頭1罐 | 醋1大匙 | 水300ml | 雞湯塊1/2塊 | 肉桂棒1根 | 鹽如果需要,材料如圖。 | 這些是這次使用到的香料，由左至右分別是：肉豆蔻粉、黑芥末籽、孜然和肉桂棒。 | 切菜：茄子切小塊、大蒜和洋蔥切碎備用。 | 熱鍋加少許油，放入孜然和黑芥末子，爆香一下。 | 接著加入洋蔥和大蒜拌炒3分鐘。 | 加入肉豆蔻粉，拌勻。 | 加入茄子、醋、水、高湯塊和鷹嘴豆罐頭。 | 再來是點仙女棒做法的部分（欸不是）：在鍋子中間插一根點燃的肉桂棒，先許願讓他變成美味的料理，再蓋上蓋子燉煮20分鐘，最後視個人口味用鹽調味。 | 成品圖。,煙燻肉桂茄子咖哩。食材：黑芥末子1小匙，孜然1小匙，洋蔥1顆，大蒜4瓣，肉豆蔻粉1/2小匙，茄子2根，鷹嘴豆罐頭1罐，醋1大匙，水300ml，雞湯塊1/2塊，肉桂棒1根，鹽如果需要。做法：材料如圖。，這些是這次使用到的香料，由左至右分別是：肉豆蔻粉、黑芥末籽、孜然和肉桂棒。，切菜：茄子切小塊、大蒜和洋蔥切碎備用。，熱鍋加少許油，放入孜然和黑芥末子，爆香一下。，接著加入洋蔥和大蒜拌炒3分鐘。，加入肉豆蔻粉，拌勻。，加入茄子、醋、水、高湯塊和鷹嘴豆罐頭。，再來是點仙女棒做法的部分（欸不是）：在鍋子中間插一根點燃的肉桂棒，先許願讓他變成美味的料理，再蓋上蓋子燉煮20分鐘，最後視個人口味用鹽調味。，成品圖。。,茄子/471538_煙燻肉桂茄子咖哩.jpg
473830,蠔油茄子雞丁,https://icook.tw/recipes/473830,蒜頭、茄子、雞丁、太白粉、蠔油、鹽,蒜頭適量 | 茄子2根 | 雞丁適量 | 太白粉適量 | 蠔油適量 | 鹽鹽,先用太白粉抓一下雞丁 | 蒜頭切碎，茄子滾邊切塊 | 先將雞丁下鍋炒到半熟後盛起備用 | 蒜頭下鍋爆香，加入茄子拌炒後，再加入雞丁拌炒，接著加入蠔油及適當的鹽調味，炒熟上色後即可上桌,蠔油茄子雞丁。食材：蒜頭適量，茄子2根，雞丁適量，太白粉適量，蠔油適量，鹽鹽。做法：先用太白粉抓一下雞丁，蒜頭切碎，茄子滾邊切塊，先將雞丁下鍋炒到半熟後盛起備用，蒜頭下鍋爆香，加入茄子拌炒後，再加入雞丁拌炒，接著加入蠔油及適當的鹽調味，炒熟上色後即可上桌。,茄子/473830_蠔油茄子雞丁.jpg
473789,西西里茄子燉菜,https://icook.tw/recipes/473789,日本茄子(圓茄子)、新鮮番茄、濃縮番茄糊/番茄膏、洋蔥、綠橄欖、酸豆、西洋芹、頂級初榨橄欖油、鹽、糖、白醋、松子,日本茄子(圓茄子)500克 | 新鮮番茄300克 | 濃縮番茄糊/番茄膏適量 | 洋蔥250克 | 綠橄欖70克 | 酸豆適量 | 西洋芹一小株 | 頂級初榨橄欖油自己喜歡的量 | 鹽少許 | 糖70克 | 白醋60-70克 | 松子(可略),"準備材料 | 將茄子切塊狀，灑一點鹽後置放約半小時去除澀味 | 洋蔥及西洋芹切小塊 | 番茄去皮後切小塊 | 熱油鍋將茄子炸成金黃色起鍋 | 同一個鍋留下適量的油，將洋蔥及西洋芹炒香 | 加入番茄塊拌炒10分鐘後，加入濃縮番茄糊（番茄糊如果太濃稠可以兌一點水）
之後加入酸豆及綠橄欖 | 加入鹽、糖、白醋調味

將炒好的西洋芹、洋蔥及橄欖這部分的料，跟茄子分開放涼 | 加入微烤過的松子，即可組合盛盤上桌","西西里茄子燉菜。食材：日本茄子(圓茄子)500克，新鮮番茄300克，濃縮番茄糊/番茄膏適量，洋蔥250克，綠橄欖70克，酸豆適量，西洋芹一小株，頂級初榨橄欖油自己喜歡的量，鹽少許，糖70克，白醋60-70克，松子(可略)。做法：準備材料，將茄子切塊狀，灑一點鹽後置放約半小時去除澀味，洋蔥及西洋芹切小塊，番茄去皮後切小塊，熱油鍋將茄子炸成金黃色起鍋，同一個鍋留下適量的油，將洋蔥及西洋芹炒香，加入番茄塊拌炒10分鐘後，加入濃縮番茄糊（番茄糊如果太濃稠可以兌一點水）
之後加入酸豆及綠橄欖，加入鹽、糖、白醋調味

將炒好的西洋芹、洋蔥及橄欖這部分的料，跟茄子分開放涼，加入微烤過的松子，即可組合盛盤上桌。",茄子/473789_西西里茄子燉菜.jpg
472415,茄子義大利麵,https://icook.tw/recipes/472415,茄子、義大利麵、鹽巴、洋蔥碎、橄欖油、義大利麵醬、義式香料/黑胡椒粉,茄子2根 | 義大利麵2人份 | 洋蔥碎1/4顆 | 義大利麵醬1罐 | 鹽巴適量 | 橄欖油適量 | 義式香料/黑胡椒粉適量,"烤箱預熱210度。茄子切小片，放入盆中，加入橄欖油、鹽巴、義式香料混合。
平鋪烤盤上烘烤25分鐘至金黃色（可翻拌1～2次） | 完成後取出。
水加少許鹽，滾水放入義大利麵，依包裝指示時間煮熟，留下少許煮麵水。 | 油鍋加入洋蔥炒，加入茄子炒，加入義大利麵醬料。 | 加入義大利麵及煮麵水拌炒即可。","茄子義大利麵。食材：茄子2根，義大利麵2人份，洋蔥碎1/4顆，義大利麵醬1罐，鹽巴適量，橄欖油適量，義式香料/黑胡椒粉適量。做法：烤箱預熱210度。茄子切小片，放入盆中，加入橄欖油、鹽巴、義式香料混合。
平鋪烤盤上烘烤25分鐘至金黃色（可翻拌1～2次），完成後取出。
水加少許鹽，滾水放入義大利麵，依包裝指示時間煮熟，留下少許煮麵水。，油鍋加入洋蔥炒，加入茄子炒，加入義大利麵醬料。，加入義大利麵及煮麵水拌炒即可。。",茄子/472415_茄子義大利麵.jpg
476300,香菇雞蛋燒茄子（蛋素）,https://icook.tw/recipes/476300,鮮香菇、茄子、香菇調味露、雞蛋、津輕醬油、白芝麻、日本芝麻油、香菜/芹菜,鮮香菇2大朵 | 茄子1條 | 雞蛋2顆 | 白芝麻1小匙 | 香菜/芹菜些許 | 香菇調味露1大匙 | 津輕醬油1匙 | 日本芝麻油1匙,"將新鮮香菇切丁，還有茄子也切丁後，
放入油鍋熱炒加入香菇調味露還有津輕醬油一起翻炒入味 | 將茄子和香菇移到鍋子另外一邊，
另外一邊的鍋子中加入玄米油再倒入兩顆雞蛋翻炒，
再加些許的香菇調味露炒勻後
再將鮮香菇和茄子和雞蛋一起翻炒，
讓香氣結合最後淋上芝麻油翻炒一下，
再撒上些許的香菜或是芹菜和白芝麻配色","香菇雞蛋燒茄子（蛋素）。食材：鮮香菇2大朵，茄子1條，雞蛋2顆，白芝麻1小匙，香菜/芹菜些許，香菇調味露1大匙，津輕醬油1匙，日本芝麻油1匙。做法：將新鮮香菇切丁，還有茄子也切丁後，
放入油鍋熱炒加入香菇調味露還有津輕醬油一起翻炒入味，將茄子和香菇移到鍋子另外一邊，
另外一邊的鍋子中加入玄米油再倒入兩顆雞蛋翻炒，
再加些許的香菇調味露炒勻後
再將鮮香菇和茄子和雞蛋一起翻炒，
讓香氣結合最後淋上芝麻油翻炒一下，
再撒上些許的香菜或是芹菜和白芝麻配色。",茄子/476300_香菇雞蛋燒茄子（蛋素）.jpg
477339,《醬燒塔香茄子豆腐》,https://icook.tw/recipes/477339,李錦記零添加頭道原釀醬油、蛋豆腐、茄子、大蒜、九層塔、生辣椒,李錦記零添加頭道原釀醬油3大匙 | 蛋豆腐1盒 | 茄子2條 | 大蒜5顆 | 九層塔1小把 | 生辣椒2根,這是一道快速又方便的料理，不愛茄子的你，嚐過這樣的料理方式，會對茄子改觀唷！醬香醇厚、鮮中回甘超級下飯 | 雞蛋豆腐切塊狀，可先放餐巾紙上吸水 | 蛋豆腐兩面煎恰恰好定型，表層微恰恰內軟嫩 | 煎好的豆腐先挑起來，利用油鍋裡的油，下茄子拌炒到表層有香氣後，加入李錦記零添加頭道原釀醬油3大匙，以往做這道菜還會加鹽巴跟糖去平衡，但現在只要一個單純醬香調味就很夠味了 | 加入ㄧ些水淹過茄子後，加蓋採悶蒸手法，讓醬香入味進茄子 | 待茄子稍軟後，再倒回豆腐，採滑動的方式，避免把豆腐用破 | 下蒜片和辣椒，我喜歡脆脆的蒜片口感，所以選擇後加，喜歡蒜頭軟軟和更入味的風味，在前面就和茄子一起煨煮 | 起鍋前下九層塔拌炒一下即可 | 醬燒塔香茄子豆腐就完成了，趕快去裝白飯配嘍,《醬燒塔香茄子豆腐》。食材：李錦記零添加頭道原釀醬油3大匙，蛋豆腐1盒，茄子2條，大蒜5顆，九層塔1小把，生辣椒2根。做法：這是一道快速又方便的料理，不愛茄子的你，嚐過這樣的料理方式，會對茄子改觀唷！醬香醇厚、鮮中回甘超級下飯，雞蛋豆腐切塊狀，可先放餐巾紙上吸水，蛋豆腐兩面煎恰恰好定型，表層微恰恰內軟嫩，煎好的豆腐先挑起來，利用油鍋裡的油，下茄子拌炒到表層有香氣後，加入李錦記零添加頭道原釀醬油3大匙，以往做這道菜還會加鹽巴跟糖去平衡，但現在只要一個單純醬香調味就很夠味了，加入ㄧ些水淹過茄子後，加蓋採悶蒸手法，讓醬香入味進茄子，待茄子稍軟後，再倒回豆腐，採滑動的方式，避免把豆腐用破，下蒜片和辣椒，我喜歡脆脆的蒜片口感，所以選擇後加，喜歡蒜頭軟軟和更入味的風味，在前面就和茄子一起煨煮，起鍋前下九層塔拌炒一下即可，醬燒塔香茄子豆腐就完成了，趕快去裝白飯配嘍。,茄子/477339_《醬燒塔香茄子豆腐》.jpg
466277,辣豆瓣茄子炒豆乾,https://icook.tw/recipes/466277,茄子、豆乾、辣豆瓣醬、豬油、醬油、九層塔、糖、蒜末,茄子2條 | 豆乾3片 | 豬油1小匙 | 九層塔1小把 | 蒜末1小匙 | 辣豆瓣醬1大匙 | 醬油1小匙 | 糖1小匙,豆乾切片、茄子切塊狀泡水備用 | 熱鍋放豬油加入豆乾煸炒至金黃爆香蒜末加入辣豆瓣醬炒香加水煮滾 | 加入茄子和其它調味料炒熟放入九層塔拌炒即可,辣豆瓣茄子炒豆乾。食材：茄子2條，豆乾3片，豬油1小匙，九層塔1小把，蒜末1小匙，辣豆瓣醬1大匙，醬油1小匙，糖1小匙。做法：豆乾切片、茄子切塊狀泡水備用，熱鍋放豬油加入豆乾煸炒至金黃爆香蒜末加入辣豆瓣醬炒香加水煮滾，加入茄子和其它調味料炒熟放入九層塔拌炒即可。,茄子/466277_辣豆瓣茄子炒豆乾.jpg
467320,茄子炒蛋,https://icook.tw/recipes/467320,雞蛋、茄子、茄汁、蒜蓉、日式醬油、橄欖油、日本酒、水、糖、鹽,雞蛋3隻 | 茄子1條 | 蒜蓉1湯匙 | 橄欖油適量 | 水20毫升 | 鹽適量 | 茄汁2湯匙 | 日式醬油1湯匙 | 日本酒2湯匙 | 糖1茶匙,茄子滾刀切塊，放在鹽水中。鹽水可以防止茄子變色，和令茄子更入味。切蔥花和蒜蓉。 | 將茄汁、日式醬油、日本酒和糖混合。 | 將蛋炒至7成熟後起鍋備用。 | 橄欖油起鍋，中火煎茄子至兩色上色。落蒜蓉，炒至金黃色後和茄子攪拌均勻。落水和醬汁，蓋上蓋子直至煮熟。 | 茄子煮熟後，落蔥花和炒好的蛋，攪拌均勻。完成 (｡◕∀◕｡),茄子炒蛋。食材：雞蛋3隻，茄子1條，蒜蓉1湯匙，橄欖油適量，水20毫升，鹽適量，茄汁2湯匙，日式醬油1湯匙，日本酒2湯匙，糖1茶匙。做法：茄子滾刀切塊，放在鹽水中。鹽水可以防止茄子變色，和令茄子更入味。切蔥花和蒜蓉。，將茄汁、日式醬油、日本酒和糖混合。，將蛋炒至7成熟後起鍋備用。，橄欖油起鍋，中火煎茄子至兩色上色。落蒜蓉，炒至金黃色後和茄子攪拌均勻。落水和醬汁，蓋上蓋子直至煮熟。，茄子煮熟後，落蔥花和炒好的蛋，攪拌均勻。完成 (｡◕∀◕｡)。,茄子/467320_茄子炒蛋.jpg
472299,鹹蛋白煮茄子,https://icook.tw/recipes/472299,日本茄子、鹹蛋白末、蒜碎、辣椒、酒、味霖、白米醋、自製檸檬果醬、昆布柴魚高湯、水,日本茄子70g1條 | 鹹蛋白末1小匙 | 蒜碎1顆份 | 辣椒1根 | 酒5cc | 味霖3cc | 白米醋3cc | 自製檸檬果醬2/3小匙 | 昆布柴魚高湯20cc | 水30cc,"茄子去蒂滾到切備用. | 取小鍋子,放入鹹蛋白末,蒜碎,辣椒,酒,味霖,白米醋及檸檬果醬煮滾出香氣,續放入步驟1裹調味料加蓋關極小火. | 煮至稍微縮水,倒入昆布柴魚高湯與水再加蓋煮熟軟,開蓋偶爾搖晃鍋子收汁即可.","鹹蛋白煮茄子。食材：日本茄子70g1條，鹹蛋白末1小匙，蒜碎1顆份，辣椒1根，酒5cc，味霖3cc，白米醋3cc，自製檸檬果醬2/3小匙，昆布柴魚高湯20cc，水30cc。做法：茄子去蒂滾到切備用.，取小鍋子,放入鹹蛋白末,蒜碎,辣椒,酒,味霖,白米醋及檸檬果醬煮滾出香氣,續放入步驟1裹調味料加蓋關極小火.，煮至稍微縮水,倒入昆布柴魚高湯與水再加蓋煮熟軟,開蓋偶爾搖晃鍋子收汁即可.。",茄子/472299_鹹蛋白煮茄子.jpg
472102,蒜蓉蒸茄子,https://icook.tw/recipes/472102,茄子、蒜頭、指天椒、青蔥、生抽、鎮江醋、糖、炸乾蔥,茄子1條 | 蒜頭1整粒 | 指天椒半條 | 青蔥1條 | 生抽3湯匙 | 鎮江醋1.5湯匙 | 糖半湯匙 | 炸乾蔥適量,"將鋁箔紙四邊摺起，防止漏汁。茄子洗淨抹乾，開半。用刀尖在茄子上𠝹出坑紋，會更入味。 | 將蒜頭和指天椒切碎，混合生抽、鎮江醋和糖。淋在茄子上。水滾用中火蒸大約十分鐘。 | 出爐後將蔥花和炸乾蔥灑上面，將鋁箔紙上的汁淋在茄子上，
完成 (｡◕∀◕｡)","蒜蓉蒸茄子。食材：茄子1條，蒜頭1整粒，指天椒半條，青蔥1條，生抽3湯匙，鎮江醋1.5湯匙，糖半湯匙，炸乾蔥適量。做法：將鋁箔紙四邊摺起，防止漏汁。茄子洗淨抹乾，開半。用刀尖在茄子上𠝹出坑紋，會更入味。，將蒜頭和指天椒切碎，混合生抽、鎮江醋和糖。淋在茄子上。水滾用中火蒸大約十分鐘。，出爐後將蔥花和炸乾蔥灑上面，將鋁箔紙上的汁淋在茄子上，
完成 (｡◕∀◕｡)。",茄子/472102_蒜蓉蒸茄子.jpg
465841,三杯茄子,https://icook.tw/recipes/465841,茄子、蒜片、蔬菜油(約半杯)、薑絲、胡麻油、紅辣椒，切片、醬油膏、九層塔、米酒、糖,茄子2條 | 蒜片少許 | 薑絲少許 | 紅辣椒，切片一條 | 九層塔適量 | 蔬菜油(約半杯)少許 | 胡麻油3大匙 | 醬油膏3-4大匙 | 米酒2大匙 | 糖1大匙,✅茄子洗淨擦乾，切成4-5公分長段。 | ✅蔬菜油放入平底鍋中，油熱後，放入茄子段，上下翻動，將茄子炸軟後，撈出瀝油。 | ✅另一炒鍋，放入胡麻油，中火加熱，爆香薑絲與蒜片，香味出來後，淋上醬油膏 | 米酒與糖，拌勻煮一下。再放入紅辣椒與炸好的茄子段，翻炒數下後，撒上九層塔，關火拌勻即可盛盤。,三杯茄子。食材：茄子2條，蒜片少許，薑絲少許，紅辣椒，切片一條，九層塔適量，蔬菜油(約半杯)少許，胡麻油3大匙，醬油膏3-4大匙，米酒2大匙，糖1大匙。做法：✅茄子洗淨擦乾，切成4-5公分長段。，✅蔬菜油放入平底鍋中，油熱後，放入茄子段，上下翻動，將茄子炸軟後，撈出瀝油。，✅另一炒鍋，放入胡麻油，中火加熱，爆香薑絲與蒜片，香味出來後，淋上醬油膏，米酒與糖，拌勻煮一下。再放入紅辣椒與炸好的茄子段，翻炒數下後，撒上九層塔，關火拌勻即可盛盤。。,茄子/465841_三杯茄子.jpg
463991,茄子肉餅,https://icook.tw/recipes/463991,茄子、洋蔥（小）、紅蘿蔔、豬絞肉、醬油,茄子1條 | 洋蔥（小）1個 | 紅蘿蔔2匙 | 豬絞肉150克 | 醬油1匙,所有材料切碎。 | 加入絞肉，拌好，加入蛋及太白粉、蕃薯粉。 | 放入煎鍋。 | 盛盤。,茄子肉餅。食材：茄子1條，洋蔥（小）1個，紅蘿蔔2匙，豬絞肉150克，醬油1匙。做法：所有材料切碎。，加入絞肉，拌好，加入蛋及太白粉、蕃薯粉。，放入煎鍋。，盛盤。。,茄子/463991_茄子肉餅.jpg
473882,懶人菜譜-茄子番茄炒蛋,https://icook.tw/recipes/473882,茄子、番茄、醬油、雞蛋、醬油膏、九層塔、烹大師、蒜末、糖（冰糖）,茄子2條 | 番茄1顆 | 雞蛋3顆 | 九層塔1小把 | 蒜末少許 | 醬油少許 | 醬油膏少許 | 烹大師少許 | 糖（冰糖）幾顆,"茄子切滾刀（薄一點比較好熟）。番茄切塊。
蛋打散後下油鍋煎好成散狀，起鍋。 | 另起油鍋，茄子需要多油，所以油多放點。
下茄子炒約4-5分軟。
接著下蒜末、番茄翻炒。
接著放入已煎好的散蛋。
加水（水量多一點，因為要燜） | 水滾後，開始調味：
下醬油、醬油膏、烹大師、幾顆冰糖（也可不加）
蓋上鍋蓋燜煮至全部軟化。 | 起鍋前，加入九層塔翻炒幾下，完成。","懶人菜譜-茄子番茄炒蛋。食材：茄子2條，番茄1顆，雞蛋3顆，九層塔1小把，蒜末少許，醬油少許，醬油膏少許，烹大師少許，糖（冰糖）幾顆。做法：茄子切滾刀（薄一點比較好熟）。番茄切塊。
蛋打散後下油鍋煎好成散狀，起鍋。，另起油鍋，茄子需要多油，所以油多放點。
下茄子炒約4-5分軟。
接著下蒜末、番茄翻炒。
接著放入已煎好的散蛋。
加水（水量多一點，因為要燜），水滾後，開始調味：
下醬油、醬油膏、烹大師、幾顆冰糖（也可不加）
蓋上鍋蓋燜煮至全部軟化。，起鍋前，加入九層塔翻炒幾下，完成。。",茄子/473882_懶人菜譜-茄子番茄炒蛋.jpg
