id,name,url,preview_ingredients,ingredients,steps,combined_text,image_path
473157,蒜苗炒高麗菜,https://icook.tw/recipes/473157,蒜苗、高麗菜、雞粉、鹽、糖,蒜苗1根 | 高麗菜0.5顆 | 雞粉1.5小匙 | 鹽1.5茶匙 | 糖0.5茶匙,將高麗菜切塊洗淨瀝乾備用、蒜苗斜切片狀 | 熱油鍋爆香蒜白加入高麗菜大火快炒 | 加入雞粉.鹽.糖調味炒至食材熟透即可,蒜苗炒高麗菜。食材：蒜苗1根，高麗菜0.5顆，雞粉1.5小匙，鹽1.5茶匙，糖0.5茶匙。做法：將高麗菜切塊洗淨瀝乾備用、蒜苗斜切片狀，熱油鍋爆香蒜白加入高麗菜大火快炒，加入雞粉.鹽.糖調味炒至食材熟透即可。,蒜苗/473157_蒜苗炒高麗菜.jpg
478735,蒜苗炒叉燒,https://icook.tw/recipes/478735,叉燒、蒜苗、蒜頭、辣椒、胡椒鹽、油,叉燒適量 | 蒜苗1支 | 蒜頭1瓣 | 辣椒適量 | 胡椒鹽適量 | 油1大匙,油熱，下蒜頭、蒜白爆香，吃辣的再加辣椒。 | 有香味之後下叉燒 | 叉燒稍微焦焦時下蒜青 | 起鍋前調味，這也是好市多買的，太大罐吃不完，當成鹽來用比較快。沒有的話鹽、味精就可以了。 | 完成,蒜苗炒叉燒。食材：叉燒適量，蒜苗1支，蒜頭1瓣，辣椒適量，胡椒鹽適量，油1大匙。做法：油熱，下蒜頭、蒜白爆香，吃辣的再加辣椒。，有香味之後下叉燒，叉燒稍微焦焦時下蒜青，起鍋前調味，這也是好市多買的，太大罐吃不完，當成鹽來用比較快。沒有的話鹽、味精就可以了。，完成。,蒜苗/478735_蒜苗炒叉燒.jpg
479556,蒜苗炒蘿蔔糕,https://icook.tw/recipes/479556,蘿蔔糕、香菜、蒜苗,蘿蔔糕300克 | 香菜1把 | 蒜苗1把,起鍋下油，煎蘿蔔糕 | 煎至兩面金黃酥脆 | 原鍋下蒜白炒香 | 蘿蔔糕及蒜綠一同下鍋 | 加入香菜拌炒的，即可調味起鍋,蒜苗炒蘿蔔糕。食材：蘿蔔糕300克，香菜1把，蒜苗1把。做法：起鍋下油，煎蘿蔔糕，煎至兩面金黃酥脆，原鍋下蒜白炒香，蘿蔔糕及蒜綠一同下鍋，加入香菜拌炒的，即可調味起鍋。,蒜苗/479556_蒜苗炒蘿蔔糕.jpg
474364,蒜苗鹹豬肉,https://icook.tw/recipes/474364,五花肉條、蒜苗或青蔥、辣椒、玄米油或其他油,五花肉條300克 | 蒜苗或青蔥2支 | 辣椒1根 | 玄米油或其他油1小匙,老媽使用特別的滷包來醃製五花肉，我撿現成的😆 | 我本身不愛吃皮，所以我將五花肉的皮去除掉之後，切成薄片或是細條狀狀 | 噴少少的油，搭配不沾平底鍋（很推薦ASD聚油環形不沾鍋），用文火慢慢煎出油 | 蒜苗也是娘家種的，老媽說鹹豬肉一定要配 | 豬肉的油慢慢被逼出來之後，蒜苗就可以下鍋一起拌炒，喜歡吃辣，可以加一根辣椒 | 我是為了拍照好看，所以配了一根去籽的辣椒，建議在準備起鍋的時候再放，這樣就不會辣了。,蒜苗鹹豬肉。食材：五花肉條300克，蒜苗或青蔥2支，辣椒1根，玄米油或其他油1小匙。做法：老媽使用特別的滷包來醃製五花肉，我撿現成的😆，我本身不愛吃皮，所以我將五花肉的皮去除掉之後，切成薄片或是細條狀狀，噴少少的油，搭配不沾平底鍋（很推薦ASD聚油環形不沾鍋），用文火慢慢煎出油，蒜苗也是娘家種的，老媽說鹹豬肉一定要配，豬肉的油慢慢被逼出來之後，蒜苗就可以下鍋一起拌炒，喜歡吃辣，可以加一根辣椒，我是為了拍照好看，所以配了一根去籽的辣椒，建議在準備起鍋的時候再放，這樣就不會辣了。。,蒜苗/474364_蒜苗鹹豬肉.jpg
475368,蒜苗炒臘肉,https://icook.tw/recipes/475368,臘肉、蒜苗,臘肉185克 | 蒜苗2根,臘肉切片，厚度約0.2～0.3公分，蒜苗斜切成片狀備用，並事先將蒜白蒜青分開 | 煮一鍋水，待水沸騰後，放入臘肉汆燙約10秒鐘 | 隨後將臘肉撈起瀝水備用 | 熱鍋，不加油放入臘肉平鋪煎炒 | 臘肉會慢慢出油，翻面後繼續煎炒 | 加入蒜白炒出蒜香味 | 再放入蒜青拌炒幾下，待蒜青油亮翠綠，即可盛盤上菜,蒜苗炒臘肉。食材：臘肉185克，蒜苗2根。做法：臘肉切片，厚度約0.2～0.3公分，蒜苗斜切成片狀備用，並事先將蒜白蒜青分開，煮一鍋水，待水沸騰後，放入臘肉汆燙約10秒鐘，隨後將臘肉撈起瀝水備用，熱鍋，不加油放入臘肉平鋪煎炒，臘肉會慢慢出油，翻面後繼續煎炒，加入蒜白炒出蒜香味，再放入蒜青拌炒幾下，待蒜青油亮翠綠，即可盛盤上菜。,蒜苗/475368_蒜苗炒臘肉.jpg
476721,蒜苗豆豉燴鯊魚肉,https://icook.tw/recipes/476721,鯊魚肉、蒜苗、豆豉、鹽巴、太白粉,鯊魚肉1塊 | 蒜苗3枝 | 豆豉1大匙 | 鹽巴2小匙 | 太白粉12小匙,鯊魚肉洗淨切小塊、蒜苗去頭後切段。 | 中火熱油鍋，乾豆豉洗淨後瀝乾放入鍋中壓一下炒香 | 倒入1小湯匙水與蒜苗大火拌炒均勻 | 放入鯊魚肉炒至魚肉變白 | 倒入2匙水和鹽巴拌炒，蓋上鍋蓋燜煮中小火3分 | 取1小匙太白粉與4匙水攪拌均勻，倒入炒鍋中拌炒勾芡，盛盤即可。,蒜苗豆豉燴鯊魚肉。食材：鯊魚肉1塊，蒜苗3枝，豆豉1大匙，鹽巴2小匙，太白粉12小匙。做法：鯊魚肉洗淨切小塊、蒜苗去頭後切段。，中火熱油鍋，乾豆豉洗淨後瀝乾放入鍋中壓一下炒香，倒入1小湯匙水與蒜苗大火拌炒均勻，放入鯊魚肉炒至魚肉變白，倒入2匙水和鹽巴拌炒，蓋上鍋蓋燜煮中小火3分，取1小匙太白粉與4匙水攪拌均勻，倒入炒鍋中拌炒勾芡，盛盤即可。。,蒜苗/476721_蒜苗豆豉燴鯊魚肉.jpg
472621,蒜苗炒香腸,https://icook.tw/recipes/472621,蒜味香腸、大蒜、酒、蒜末、醬油、薑末、鹽,蒜味香腸4根 | 大蒜2根 | 蒜末1小匙 | 薑末1小匙 | 酒1大匙 | 醬油1小匙 | 鹽些許,"香腸斜切片 | 大蒜洗淨也斜切片。
熱鍋 | 倒入些許橄欖油 | 放蒜末薑末炒香 | 放進香腸炒至變色炒熟 | 倒進 [調料］略炒 | 最後放進蒜苗一起拌炒炒勻即可。","蒜苗炒香腸。食材：蒜味香腸4根，大蒜2根，蒜末1小匙，薑末1小匙，酒1大匙，醬油1小匙，鹽些許。做法：香腸斜切片，大蒜洗淨也斜切片。
熱鍋，倒入些許橄欖油，放蒜末薑末炒香，放進香腸炒至變色炒熟，倒進 [調料］略炒，最後放進蒜苗一起拌炒炒勻即可。。",蒜苗/472621_蒜苗炒香腸.jpg
473791,鹹蛋黃金沙蒜苗炒板豆腐,https://icook.tw/recipes/473791,板豆腐、鹹蛋黃金沙調味料、蒜苗,板豆腐1盒 | 鹹蛋黃金沙調味料1包 | 蒜苗1根,蒜苗斜切、板豆腐切片備用 | 熱油鍋放入版豆腐煎至金黃後盛起 | 將鍋中放入20 ml的油加入鹹蛋黃風味調味粉拌勻 | 放入蒜苗炒香後，將板豆腐加入拌勻即可,鹹蛋黃金沙蒜苗炒板豆腐。食材：板豆腐1盒，鹹蛋黃金沙調味料1包，蒜苗1根。做法：蒜苗斜切、板豆腐切片備用，熱油鍋放入版豆腐煎至金黃後盛起，將鍋中放入20 ml的油加入鹹蛋黃風味調味粉拌勻，放入蒜苗炒香後，將板豆腐加入拌勻即可。,蒜苗/473791_鹹蛋黃金沙蒜苗炒板豆腐.jpg
473147,蒜苗炒梅花肉,https://icook.tw/recipes/473147,梅花肉、豆乾、鹽、蒜苗、片栗粉、醬油、蠔油、羅漢果糖、粗粒黑胡椒,梅花肉300克 | 豆乾5塊 | 蒜苗3支 | 鹽1小匙 | 片栗粉1小匙 | 醬油1大匙 | 蠔油1大匙 | 羅漢果糖1小匙 | 粗粒黑胡椒適量,將梅花肉切成較薄的片狀，加入 1 小匙鹽 和 1 小匙片栗粉，充分抓拌均勻，醃10分鍾 | 使用平底鍋加熱，倒入少許油，將豆乾放入鍋中煎 | 將豆乾放入鍋中，以中小火煎至表面金黃 | 熱鍋後加入大蒜片油，若無大蒜片，可改用 3 瓣大蒜切片與一般食用油爆香，以達相同風味效果。 | 加入白蒜苗翻炒至香氣釋放，加入醃好的後炒至半熟 | 加入煎至金黃的豆乾，接著倒入 1 大匙醬油，翻炒均勻，使豆乾充分吸收醬香。 | 再加入 1 大匙半蠔油，翻炒均勻，使豆乾充分吸收醬汁。 | 加入 1 小匙羅漢果糖，翻炒均勻。 | 加入 粗粒黑胡椒，翻炒均勻。 | 最後加入 綠蒜苗，快速翻炒至微軟且釋放香氣，即可完成。,蒜苗炒梅花肉。食材：梅花肉300克，豆乾5塊，蒜苗3支，鹽1小匙，片栗粉1小匙，醬油1大匙，蠔油1大匙，羅漢果糖1小匙，粗粒黑胡椒適量。做法：將梅花肉切成較薄的片狀，加入 1 小匙鹽 和 1 小匙片栗粉，充分抓拌均勻，醃10分鍾，使用平底鍋加熱，倒入少許油，將豆乾放入鍋中煎，將豆乾放入鍋中，以中小火煎至表面金黃，熱鍋後加入大蒜片油，若無大蒜片，可改用 3 瓣大蒜切片與一般食用油爆香，以達相同風味效果。，加入白蒜苗翻炒至香氣釋放，加入醃好的後炒至半熟，加入煎至金黃的豆乾，接著倒入 1 大匙醬油，翻炒均勻，使豆乾充分吸收醬香。，再加入 1 大匙半蠔油，翻炒均勻，使豆乾充分吸收醬汁。，加入 1 小匙羅漢果糖，翻炒均勻。，加入 粗粒黑胡椒，翻炒均勻。，最後加入 綠蒜苗，快速翻炒至微軟且釋放香氣，即可完成。。,蒜苗/473147_蒜苗炒梅花肉.jpg
471631,臘雞腿炒蒜苗,https://icook.tw/recipes/471631,臘雞腿、蒜苗、辣椒、鹽巴、砂糖、米酒,臘雞腿1支 | 蒜苗200克 | 辣椒20克 | 鹽巴1小匙 | 砂糖1茶匙 | 米酒1大匙,"❶臘雞腿去骨後切片狀 | 蒜苗將蒜白蒜綠分開 | 再斜切成段
❷熱鍋熱油後將臘肉煸炒至8分熟 | 再放入蒜白翻炒
❸加一點鹽巴提味 | 少許砂糖調味 | 淋點米酒嗆香 | 翻炒均勻
❹最後加入蒜綠、辣椒 | 翻炒均勻即可起鍋","臘雞腿炒蒜苗。食材：臘雞腿1支，蒜苗200克，辣椒20克，鹽巴1小匙，砂糖1茶匙，米酒1大匙。做法：❶臘雞腿去骨後切片狀，蒜苗將蒜白蒜綠分開，再斜切成段
❷熱鍋熱油後將臘肉煸炒至8分熟，再放入蒜白翻炒
❸加一點鹽巴提味，少許砂糖調味，淋點米酒嗆香，翻炒均勻
❹最後加入蒜綠、辣椒，翻炒均勻即可起鍋。",蒜苗/471631_臘雞腿炒蒜苗.jpg
473036,蒜苗豆乾炒鹹豬肉,https://icook.tw/recipes/473036,鹹豬肉、蒜苗、豆乾、米酒、黑胡椒,鹹豬肉50克 | 蒜苗6支 | 豆乾3片 | 米酒1大匙 | 黑胡椒適量,"蒜苗斜切，分蒜白蒜綠；豆乾、鹹豬肉切片。 | 熱鍋熱油，放入鹹豬肉炒出香氣。
（這裡的鹹豬肉買來的時候已經是熟的了。）
這邊的鹹豬肉主要是瘦肉，若是肥肉比較多的部分，食用油可以少放。 | 加入豆乾拌炒，熗入米酒。 | 加入蒜白炒1-2分鐘。 | 加入蒜綠、黑胡椒拌炒。 | 蒜綠呈現油亮狀，即可出鍋。 | 完成。","蒜苗豆乾炒鹹豬肉。食材：鹹豬肉50克，蒜苗6支，豆乾3片，米酒1大匙，黑胡椒適量。做法：蒜苗斜切，分蒜白蒜綠；豆乾、鹹豬肉切片。，熱鍋熱油，放入鹹豬肉炒出香氣。
（這裡的鹹豬肉買來的時候已經是熟的了。）
這邊的鹹豬肉主要是瘦肉，若是肥肉比較多的部分，食用油可以少放。，加入豆乾拌炒，熗入米酒。，加入蒜白炒1-2分鐘。，加入蒜綠、黑胡椒拌炒。，蒜綠呈現油亮狀，即可出鍋。，完成。。",蒜苗/473036_蒜苗豆乾炒鹹豬肉.jpg
473822,烤烏魚子佐蒜苗白蘿蔔,https://icook.tw/recipes/473822,烏魚子、白蘿蔔、蒜苗、高粱酒,烏魚子1片 | 烏魚子1片 | 白蘿蔔1段 | 白蘿蔔1段 | 蒜苗2支 | 蒜苗2支 | 高粱酒2杯 | 高粱酒2杯,取淺盤，將烏魚子浸泡高粱酒 | 將浸泡的酒倒掉，重新加入高粱酒，點火烤烏魚子 | 烤至有香氣表皮微焦即可 | 放涼後才斜切片，白蘿蔔也切薄片，蒜苗切片，組裝成盤,烤烏魚子佐蒜苗白蘿蔔。食材：烏魚子1片，烏魚子1片，白蘿蔔1段，白蘿蔔1段，蒜苗2支，蒜苗2支，高粱酒2杯，高粱酒2杯。做法：取淺盤，將烏魚子浸泡高粱酒，將浸泡的酒倒掉，重新加入高粱酒，點火烤烏魚子，烤至有香氣表皮微焦即可，放涼後才斜切片，白蘿蔔也切薄片，蒜苗切片，組裝成盤。,蒜苗/473822_烤烏魚子佐蒜苗白蘿蔔.jpg
464712,自種小蒜苗炒豆腐,https://icook.tw/recipes/464712,水豆腐、蒜苗、胡蘿蔔絲、鹽、油,水豆腐2小塊 | 蒜苗1把 | 胡蘿蔔絲1大匙 | 鹽1小匙 | 油2大匙,先把豆腐切塊，用油煎到兩面金黃 | 把蒜苗切段跟蘿蔔切絲 | 把豆腐稍微推到邊邊，中間再下點油，炒胡蘿蔔絲 | 最後加入蒜苗，一點鹽調味，翻炒至熟 | 完成~,自種小蒜苗炒豆腐。食材：水豆腐2小塊，蒜苗1把，胡蘿蔔絲1大匙，鹽1小匙，油2大匙。做法：先把豆腐切塊，用油煎到兩面金黃，把蒜苗切段跟蘿蔔切絲，把豆腐稍微推到邊邊，中間再下點油，炒胡蘿蔔絲，最後加入蒜苗，一點鹽調味，翻炒至熟，完成~。,蒜苗/464712_自種小蒜苗炒豆腐.jpg
473191,十分鐘上菜-回鍋肉炒蒜苗,https://icook.tw/recipes/473191,五花肉、蒜苗、小磨坊純白胡椒粉、醬油、鹽巴,五花肉300g | 蒜苗3根 | 小磨坊純白胡椒粉1小匙 | 醬油1小匙 | 鹽巴適量,將五花肉切薄片，加入平底鍋，以小火乾煎肉片，逼出白肉的油脂來，香氣全靠白肉嘍。 | 加入小磨坊白胡椒粉調香去腥羶味。 | 待肉片表面稍微金黃，滴入一小匙的醬油調出醬香味。 | 加入少許鹽巴調味，因為加了少量的醬油，鹽巴的份量就請大家斟酌使用。 | 稍加拌炒後就將切斜刀的蒜苗放入鍋中拌炒，記得要讓蒜苗收成才能熄火裝盤。 | 開動嘍！,十分鐘上菜-回鍋肉炒蒜苗。食材：五花肉300g，蒜苗3根，小磨坊純白胡椒粉1小匙，醬油1小匙，鹽巴適量。做法：將五花肉切薄片，加入平底鍋，以小火乾煎肉片，逼出白肉的油脂來，香氣全靠白肉嘍。，加入小磨坊白胡椒粉調香去腥羶味。，待肉片表面稍微金黃，滴入一小匙的醬油調出醬香味。，加入少許鹽巴調味，因為加了少量的醬油，鹽巴的份量就請大家斟酌使用。，稍加拌炒後就將切斜刀的蒜苗放入鍋中拌炒，記得要讓蒜苗收成才能熄火裝盤。，開動嘍！。,蒜苗/473191_十分鐘上菜-回鍋肉炒蒜苗.jpg
471192,蒜苗醬燒烏魚 / 家常菜,https://icook.tw/recipes/471192,烏魚、老薑切絲、蠔油或醬油、蒜苗、烏醋、蒜瓣、米酒、辣椒、白胡椒粉、油、水,烏魚1/2尾 | 老薑切絲4片 | 蒜苗1支 | 蒜瓣4瓣 | 辣椒1/3根 | 油3小匙 | 蠔油或醬油1大匙 | 烏醋1/2大匙 | 米酒3大匙 | 白胡椒粉1/3小匙 | 水50毫升,"●烏魚殼選魚眼睛明亮的，請攤商幫處理（去鰓、去鱗、切輪圈塊），烹煮前再一塊塊洗過，魚沒血水才不會腥。
●老薑洗淨切片後再切絲；蒜苗洗淨斜切將蒜白跟蒜綠分開擺放；蒜瓣洗過拍碎剝膜；辣椒洗淨抽掉辣椒籽才不會辣剪斜片。 | ●鍋中小火先加1小匙油潤鍋，均勻擺好魚塊，設定計時器蓋鍋煎6分鐘，6分鐘後用炒匙小心將魚塊翻面。 | ●把蒜瓣跟薑絲放到鍋中間，補上剩下的2小匙油，設定計時器蓋鍋煎2分鐘，2分鐘後用炒匙小心將烏魚先盛出。 | ●買到的烏魚很肥，用鍋中的油脂把蒜白加進來拌炒出蒜香。 | ●再把烏魚小心放回鍋中，把醬燒醬汁材料加進來，設定計時器蓋鍋燒煮2分鐘，讓烏魚全熟也吸飽醬汁。 | ●鍋中醬汁滾起，打開鍋蓋燒煮讓醬汁收汁能更巴覆在烏魚上，將蒜綠跟辣椒片，烏魚盛盤後熄火，用鍋中餘溫將蒜綠略炒，完成。 | 鮮美下飯","蒜苗醬燒烏魚 / 家常菜。食材：烏魚1/2尾，老薑切絲4片，蒜苗1支，蒜瓣4瓣，辣椒1/3根，油3小匙，蠔油或醬油1大匙，烏醋1/2大匙，米酒3大匙，白胡椒粉1/3小匙，水50毫升。做法：●烏魚殼選魚眼睛明亮的，請攤商幫處理（去鰓、去鱗、切輪圈塊），烹煮前再一塊塊洗過，魚沒血水才不會腥。
●老薑洗淨切片後再切絲；蒜苗洗淨斜切將蒜白跟蒜綠分開擺放；蒜瓣洗過拍碎剝膜；辣椒洗淨抽掉辣椒籽才不會辣剪斜片。，●鍋中小火先加1小匙油潤鍋，均勻擺好魚塊，設定計時器蓋鍋煎6分鐘，6分鐘後用炒匙小心將魚塊翻面。，●把蒜瓣跟薑絲放到鍋中間，補上剩下的2小匙油，設定計時器蓋鍋煎2分鐘，2分鐘後用炒匙小心將烏魚先盛出。，●買到的烏魚很肥，用鍋中的油脂把蒜白加進來拌炒出蒜香。，●再把烏魚小心放回鍋中，把醬燒醬汁材料加進來，設定計時器蓋鍋燒煮2分鐘，讓烏魚全熟也吸飽醬汁。，●鍋中醬汁滾起，打開鍋蓋燒煮讓醬汁收汁能更巴覆在烏魚上，將蒜綠跟辣椒片，烏魚盛盤後熄火，用鍋中餘溫將蒜綠略炒，完成。，鮮美下飯。",蒜苗/471192_蒜苗醬燒烏魚___家常菜.jpg
470686,青蒜苗炒蕃茄蛋🎶,https://icook.tw/recipes/470686,蕃茄、青蒜苗、海鹽、雞蛋、白胡椒粉、香油,蕃茄5顆 | 青蒜苗3株 | 雞蛋4顆 | 海鹽1/2茶匙 | 白胡椒粉1/4茶匙 | 香油適量,準備食材。 | 蕃茄洗淨、切塊。 | 青蒜苗洗淨、斜切(蒜白與蒜綠分開)，雞蛋打成蛋液，備用。 | 鍋內倒入油，以中小火將鍋油預熱後，倒入蛋液。 | 蛋液炒至半熟起鍋備用。 | 原鍋，倒適量蔬菜油，將蒜白入鍋炒香。 | 再將蕃茄入鍋拌炒，蓋上鍋蓋燜煮5分鐘。 | 然後把炒蛋倒入鍋，拌炒至喜歡的熟度。 | 以海鹽、白胡椒粉調味，滴適量香油增加香味。 | 最後把蒜綠入鍋。 | 快速拌勻後，即可熄火、起鍋。 | 香噴噴上桌享用。,青蒜苗炒蕃茄蛋🎶。食材：蕃茄5顆，青蒜苗3株，雞蛋4顆，海鹽1/2茶匙，白胡椒粉1/4茶匙，香油適量。做法：準備食材。，蕃茄洗淨、切塊。，青蒜苗洗淨、斜切(蒜白與蒜綠分開)，雞蛋打成蛋液，備用。，鍋內倒入油，以中小火將鍋油預熱後，倒入蛋液。，蛋液炒至半熟起鍋備用。，原鍋，倒適量蔬菜油，將蒜白入鍋炒香。，再將蕃茄入鍋拌炒，蓋上鍋蓋燜煮5分鐘。，然後把炒蛋倒入鍋，拌炒至喜歡的熟度。，以海鹽、白胡椒粉調味，滴適量香油增加香味。，最後把蒜綠入鍋。，快速拌勻後，即可熄火、起鍋。，香噴噴上桌享用。。,蒜苗/470686_青蒜苗炒蕃茄蛋🎶.jpg
459608,蒜苗燒魚,https://icook.tw/recipes/459608,鯛魚片或全魚、大蒜苗 、醬油、薑片、米酒、糖、烏醋,鯛魚片或全魚2~4片或1隻 | 大蒜苗 1支 | 薑片4片 | 醬油2.5大匙 | 米酒1大匙 | 糖1小匙 | 烏醋1.5小匙,魚兩面煎至微焦 (亦可薄撒一層太白粉) | 加入蒜苗、薑拌炒至有香味 | 倒入醬汁，加水50~100ml蓋過食材，蓋鍋小火燜煮6分鐘 | 開鍋蓋，讓醬汁稍微收乾即可,蒜苗燒魚。食材：鯛魚片或全魚2~4片或1隻，大蒜苗 1支，薑片4片，醬油2.5大匙，米酒1大匙，糖1小匙，烏醋1.5小匙。做法：魚兩面煎至微焦 (亦可薄撒一層太白粉)，加入蒜苗、薑拌炒至有香味，倒入醬汁，加水50~100ml蓋過食材，蓋鍋小火燜煮6分鐘，開鍋蓋，讓醬汁稍微收乾即可。,蒜苗/459608_蒜苗燒魚.jpg
454291,蒜苗五花肉,https://icook.tw/recipes/454291,蒜苗、五花肉、乾香菇、蠔油、米酒、辣椒、白胡椒、香油,蒜苗2支 | 五花肉1.5條 | 乾香菇8朵 | 蠔油1大匙 | 米酒1匙 | 辣椒1根 | 白胡椒1小匙 | 香油1匙,蒜苗斜切、五花肉切片、香菇泡發、辣椒切丁備用 | 熱鍋轉小火下五花肉乾煎 | 五花肉出油後轉中大火，泡發香菇擠乾水分後加入鍋中拌炒 | 加入蠔油炒香 | 加入一大匙香菇水、酒、白胡椒炒至收汁 | 加入蒜苗、辣椒拌炒 | 出鍋前淋上香油拌炒後完成,蒜苗五花肉。食材：蒜苗2支，五花肉1.5條，乾香菇8朵，蠔油1大匙，米酒1匙，辣椒1根，白胡椒1小匙，香油1匙。做法：蒜苗斜切、五花肉切片、香菇泡發、辣椒切丁備用，熱鍋轉小火下五花肉乾煎，五花肉出油後轉中大火，泡發香菇擠乾水分後加入鍋中拌炒，加入蠔油炒香，加入一大匙香菇水、酒、白胡椒炒至收汁，加入蒜苗、辣椒拌炒，出鍋前淋上香油拌炒後完成。,蒜苗/454291_蒜苗五花肉.jpg
455371,蒜苗皇帝豆炒木耳及魚丸,https://icook.tw/recipes/455371,皇帝豆、魚丸、雞粉、蒜苗、醬油、木耳、胡椒粉,皇帝豆300克 | 魚丸6顆 | 蒜苗1根 | 木耳少許 | 雞粉2小匙 | 醬油1大匙 | 胡椒粉1小匙,將蒜苗斜切備用，魚丸切片 | 熱油鍋放入蒜苗白炒香加入皇帝豆、魚丸和木耳道路醬油翻炒蓋鍋 | 待食材熟透後加入蒜苗青與雞粉、胡椒粉即可,蒜苗皇帝豆炒木耳及魚丸。食材：皇帝豆300克，魚丸6顆，蒜苗1根，木耳少許，雞粉2小匙，醬油1大匙，胡椒粉1小匙。做法：將蒜苗斜切備用，魚丸切片，熱油鍋放入蒜苗白炒香加入皇帝豆、魚丸和木耳道路醬油翻炒蓋鍋，待食材熟透後加入蒜苗青與雞粉、胡椒粉即可。,蒜苗/455371_蒜苗皇帝豆炒木耳及魚丸.jpg
465028,鴻禧菇蒜苗炒鴨賞,https://icook.tw/recipes/465028,鴨賞、鴻禧菇、蒜片、蒜苗、白芝麻,鴨賞1包 | 鴻禧菇1包 | 蒜片4瓣 | 蒜苗3支 | 白芝麻撒2下,蒜頭切片，蒜苗洗淨後切段 | 中火熱鍋放油，放入蒜頭微炒香後加入菇拌炒均勻 | 續加入鴨賞拌炒，讓菇與鴨賞油酯結合一起 | 先放入蒜白部分炒軟 | 後加入蒜綠與黑胡椒拌炒均勻 | 盛盤灑上白胡椒即可,鴻禧菇蒜苗炒鴨賞。食材：鴨賞1包，鴻禧菇1包，蒜片4瓣，蒜苗3支，白芝麻撒2下。做法：蒜頭切片，蒜苗洗淨後切段，中火熱鍋放油，放入蒜頭微炒香後加入菇拌炒均勻，續加入鴨賞拌炒，讓菇與鴨賞油酯結合一起，先放入蒜白部分炒軟，後加入蒜綠與黑胡椒拌炒均勻，盛盤灑上白胡椒即可。,蒜苗/465028_鴻禧菇蒜苗炒鴨賞.jpg
456075,🐷蒜苗炒鹹豬肉,https://icook.tw/recipes/456075,鹹豬肉、蒜苗、蒜瓣、洋蔥,鹹豬肉1條 | 蒜苗1支 | 蒜瓣5瓣 | 洋蔥1/2顆,"1. 備料
（1）蒜苗斜切分成蒜綠與蒜白
（2）洋蔥切絲
（3）蒜瓣去皮去頭用刀切成蒜末
（4）鹹豬肉切片狀 | 2. 取一炒鍋
將切好的鹹豬肉小火慢煎 | 3. 逼出豬肉原本的油脂 | 4. 轉中火利用油脂爆香蒜末 | 5. 後加入洋蔥與蒜白快速翻炒 | 6. 最後加入蒜綠轉大火快炒即完成✔️
盛盤即可上桌！","🐷蒜苗炒鹹豬肉。食材：鹹豬肉1條，蒜苗1支，蒜瓣5瓣，洋蔥1/2顆。做法：1. 備料
（1）蒜苗斜切分成蒜綠與蒜白
（2）洋蔥切絲
（3）蒜瓣去皮去頭用刀切成蒜末
（4）鹹豬肉切片狀，2. 取一炒鍋
將切好的鹹豬肉小火慢煎，3. 逼出豬肉原本的油脂，4. 轉中火利用油脂爆香蒜末，5. 後加入洋蔥與蒜白快速翻炒，6. 最後加入蒜綠轉大火快炒即完成✔️
盛盤即可上桌！。",蒜苗/456075_🐷蒜苗炒鹹豬肉.jpg
456464,蒜苗炒松阪豬,https://icook.tw/recipes/456464,松阪豬肉、蒜苗、米酒、蒜頭、醬油、薑、白胡椒粉、辣椒、太白粉、糖、鳳梨、香油,松阪豬肉1塊 | 蒜苗2根 | 蒜頭2瓣 | 薑3片 | 辣椒1根 | 米酒1大匙 | 醬油1大匙 | 白胡椒粉適量 | 太白粉1大匙 | 鳳梨100公克 | 醬油1.5大匙 | 白胡椒粉適量 | 糖1小匙 | 米酒1小匙 | 香油1小匙,松阪豬逆紋切薄片，(可以稍微冷凍一下，在有點凍的狀態下比較好切) | 蒜苗切段、蒜頭、辣椒、薑切片。 | 把一塊鳳梨加點水用果汁機攪打成鳳梨泥，倒到切好的松阪肉裡，醃約5分鐘，不要醃太久，不然會失去松阪肉的口感，當然如果你想要更好咬，可以再久一點沒關係。 | 5分鐘後，把鳳梨泥倒掉，把松阪肉用清水洗一下，然後下醃料再50分鐘。 | 鍋中下油，把蒜白部份、蒜頭、辣椒、薑放下去炒香。 | 再把松阪肉放下去炒一下，下調味料，肉炒熟後，最後蒜青的部分下去再稍拌一下即可。 | 起鍋前下點香油即完成，,蒜苗炒松阪豬。食材：松阪豬肉1塊，蒜苗2根，蒜頭2瓣，薑3片，辣椒1根，米酒1大匙，醬油1大匙，白胡椒粉適量，太白粉1大匙，鳳梨100公克，醬油1.5大匙，白胡椒粉適量，糖1小匙，米酒1小匙，香油1小匙。做法：松阪豬逆紋切薄片，(可以稍微冷凍一下，在有點凍的狀態下比較好切)，蒜苗切段、蒜頭、辣椒、薑切片。，把一塊鳳梨加點水用果汁機攪打成鳳梨泥，倒到切好的松阪肉裡，醃約5分鐘，不要醃太久，不然會失去松阪肉的口感，當然如果你想要更好咬，可以再久一點沒關係。，5分鐘後，把鳳梨泥倒掉，把松阪肉用清水洗一下，然後下醃料再50分鐘。，鍋中下油，把蒜白部份、蒜頭、辣椒、薑放下去炒香。，再把松阪肉放下去炒一下，下調味料，肉炒熟後，最後蒜青的部分下去再稍拌一下即可。，起鍋前下點香油即完成，。,蒜苗/456464_蒜苗炒松阪豬.jpg
