id,name,url,preview_ingredients,ingredients,steps,combined_text,image_path
477798,玉米筍香腸雙蔥佛卡夏,https://icook.tw/recipes/477798,水、橄欖油、番茄紅醬、高筋麵粉、炒熟洋蔥絲、鹽、德式香腸片、帕馬森乳酪粉、熟玉米筍、義式香料、青蔥末、速發酵母、乳酪絲、帕馬森起司粉,水100克 | 橄欖油10克 | 高筋麵粉200克 | 鹽2克 | 帕馬森乳酪粉10克 | 義式香料1克 | 速發酵母1克 | 番茄紅醬1大匙 | 炒熟洋蔥絲1/2杯 | 德式香腸片1根 | 熟玉米筍2根 | 青蔥末2大匙 | 乳酪絲1/2杯 | 帕馬森起司粉1大匙,於容器中依序放入麵粉、鹽、糖、和酵母，混合拌勻。量秤好的水與橄欖油倒入容器中，使用矽膠刮鏟將所有材料充分攪拌均勻後，室溫靜置15至20分鐘。 | 開始第一次拉伸折疊，約7至8次或麵團變得緊繃後靜置15至20分鐘。第二次拉伸折疊，同樣是7至8次後，為避免室溫高過度發酵，移置冰箱冷藏靜置15至20分鐘。第三次拉折後，室溫靜置30分鐘，再一次拉折靜置20分鐘，接著冷藏低溫隔夜發酵。 | 翌日取出麵團狀態。 | 翌日取出麵團於塗抹橄欖油的工作台上，手勢輕柔的拉伸展開麵團成長方。 | 於麵團1 | 3處由上往下折二次。重覆上述動作，由上往下折二次後，麵團移置鋪有烘焙紙的容器等待完成最後發酵。35度50-60分鐘。 | 完成最後發酵。 | 烤箱連同烤盤一起預熱，230度。預熱完成，擺放備好的鋪頂食材於麵團表面，淋上橄欖油。 | 鋪滿乳酪絲後，手指打濕札洞，再撒上帕瑪森乳酪粉。 | 接著送進預熱好的烤盤上，烤溫降至220度置上層烘烤15分鐘，烤盤移至下層續烤4-5分鐘。,玉米筍香腸雙蔥佛卡夏。食材：水100克，橄欖油10克，高筋麵粉200克，鹽2克，帕馬森乳酪粉10克，義式香料1克，速發酵母1克，番茄紅醬1大匙，炒熟洋蔥絲1/2杯，德式香腸片1根，熟玉米筍2根，青蔥末2大匙，乳酪絲1/2杯，帕馬森起司粉1大匙。做法：於容器中依序放入麵粉、鹽、糖、和酵母，混合拌勻。量秤好的水與橄欖油倒入容器中，使用矽膠刮鏟將所有材料充分攪拌均勻後，室溫靜置15至20分鐘。，開始第一次拉伸折疊，約7至8次或麵團變得緊繃後靜置15至20分鐘。第二次拉伸折疊，同樣是7至8次後，為避免室溫高過度發酵，移置冰箱冷藏靜置15至20分鐘。第三次拉折後，室溫靜置30分鐘，再一次拉折靜置20分鐘，接著冷藏低溫隔夜發酵。，翌日取出麵團狀態。，翌日取出麵團於塗抹橄欖油的工作台上，手勢輕柔的拉伸展開麵團成長方。，於麵團1，3處由上往下折二次。重覆上述動作，由上往下折二次後，麵團移置鋪有烘焙紙的容器等待完成最後發酵。35度50-60分鐘。，完成最後發酵。，烤箱連同烤盤一起預熱，230度。預熱完成，擺放備好的鋪頂食材於麵團表面，淋上橄欖油。，鋪滿乳酪絲後，手指打濕札洞，再撒上帕瑪森乳酪粉。，接著送進預熱好的烤盤上，烤溫降至220度置上層烘烤15分鐘，烤盤移至下層續烤4-5分鐘。。,玉米筍/477798_玉米筍香腸雙蔥佛卡夏.jpg
457757,甜豆炒玉米筍,https://icook.tw/recipes/457757,甜豆、玉米筍、雞粉、紅蘿蔔片、鹽巴,甜豆300克 | 玉米筍1盒 | 紅蘿蔔片8片 | 雞粉1小匙 | 鹽巴1.5小匙,甜豆洗淨瀝乾、玉米筍寫切備用 | 熱油鍋放入紅蘿蔔片拌炒 | 加入玉米筍與甜豆與少許水中火返炒 | 加入鹽巴與雞粉拌炒均勻即可,甜豆炒玉米筍。食材：甜豆300克，玉米筍1盒，紅蘿蔔片8片，雞粉1小匙，鹽巴1.5小匙。做法：甜豆洗淨瀝乾、玉米筍寫切備用，熱油鍋放入紅蘿蔔片拌炒，加入玉米筍與甜豆與少許水中火返炒，加入鹽巴與雞粉拌炒均勻即可。,玉米筍/457757_甜豆炒玉米筍.jpg
469471,金沙茭白筍玉米筍,https://icook.tw/recipes/469471,鹹蛋、茭白荀、玉米筍、蒜頭、橄欖油、水、胡椒粉,鹹蛋2顆 | 茭白荀10支 | 玉米筍120克 | 蒜頭8瓣 | 橄欖油2大匙 | 水3大匙 | 胡椒粉適量,茭白筍洗淨去殼及粗皮後切片、玉米筍洗淨後切滾刀 | 將鹹蛋黃取出切碎、鹹蛋白另切末備用 | 起鍋加水、茭白筍及玉米筍煮熟至收汁撈起備用 | 同鍋熱油下鹹蛋黃以中小火炒至起泡後加蒜末炒香 | 再把茭白筍、玉米筍一起放回鍋中稍微拌炒 | 接著下鹹蛋白炒香 | 最後灑上胡椒粉提味即可,金沙茭白筍玉米筍。食材：鹹蛋2顆，茭白荀10支，玉米筍120克，蒜頭8瓣，橄欖油2大匙，水3大匙，胡椒粉適量。做法：茭白筍洗淨去殼及粗皮後切片、玉米筍洗淨後切滾刀，將鹹蛋黃取出切碎、鹹蛋白另切末備用，起鍋加水、茭白筍及玉米筍煮熟至收汁撈起備用，同鍋熱油下鹹蛋黃以中小火炒至起泡後加蒜末炒香，再把茭白筍、玉米筍一起放回鍋中稍微拌炒，接著下鹹蛋白炒香，最後灑上胡椒粉提味即可。,玉米筍/469471_金沙茭白筍玉米筍.jpg
467919,秋葵炒玉米筍,https://icook.tw/recipes/467919,秋葵、洋蔥、紅蘿蔔、玉米筍、蒜蓉醬,秋葵6根 | 洋蔥1/4顆 | 紅蘿蔔1/3條 | 玉米筍1盒 | 蒜蓉醬適量,"食材切喜歡的大小。 | 油鍋加入洋蔥拌炒。
加入秋葵拌炒，加少許的水蓋上鍋蓋燜煮。 | 加入紅蘿蔔絲、玉米筍，同樣加入少許的水蓋上鍋蓋燜煮。
到達喜歡的熟度，加2小匙蒜蓉醬即可。","秋葵炒玉米筍。食材：秋葵6根，洋蔥1/4顆，紅蘿蔔1/3條，玉米筍1盒，蒜蓉醬適量。做法：食材切喜歡的大小。，油鍋加入洋蔥拌炒。
加入秋葵拌炒，加少許的水蓋上鍋蓋燜煮。，加入紅蘿蔔絲、玉米筍，同樣加入少許的水蓋上鍋蓋燜煮。
到達喜歡的熟度，加2小匙蒜蓉醬即可。。",玉米筍/467919_秋葵炒玉米筍.jpg
468092,水蓮炒玉米筍,https://icook.tw/recipes/468092,水蓮、玉米筍、蒜頭、鹽、水,水蓮1包 | 玉米筍1盒 | 蒜頭2瓣 | 鹽小匙 | 水1大匙,水蓮切小段，泡水清洗 | 玉米筍洗淨，切小段 | 熱油鍋，放入拍扁的蒜瓣 | 放入玉米筍，水蓮，加一湯匙的水拌炒 | 炒到水蓮變軟，加鹽拌炒就差不多完成了 | 清甜爽口,水蓮炒玉米筍。食材：水蓮1包，玉米筍1盒，蒜頭2瓣，鹽小匙，水1大匙。做法：水蓮切小段，泡水清洗，玉米筍洗淨，切小段，熱油鍋，放入拍扁的蒜瓣，放入玉米筍，水蓮，加一湯匙的水拌炒，炒到水蓮變軟，加鹽拌炒就差不多完成了，清甜爽口。,玉米筍/468092_水蓮炒玉米筍.jpg
425055,金沙玉米筍,https://icook.tw/recipes/425055,玉米筍、鹹鴨蛋、蔥末、蒜末、辣椒,玉米筍2盒 | 鹹鴨蛋2顆 | 蔥末1根 | 蒜末2瓣 | 辣椒隨意,準備食材-鹹鴨蛋將蛋白 | 蛋黃分開切碎；玉米筍加一匙鹽川燙3分鐘撈起備用。 | 起油鍋，將玉米筍煎至微焦，起鍋備用。 | 鍋中加入3大匙油，放入鹹蛋黃 | 蒜末，以中小火炒至起泡。 | 放回玉米筍 | 鹹蛋白拌炒，起鍋前灑上蔥花 | 辣椒，即可完成。,金沙玉米筍。食材：玉米筍2盒，鹹鴨蛋2顆，蔥末1根，蒜末2瓣，辣椒隨意。做法：準備食材-鹹鴨蛋將蛋白，蛋黃分開切碎；玉米筍加一匙鹽川燙3分鐘撈起備用。，起油鍋，將玉米筍煎至微焦，起鍋備用。，鍋中加入3大匙油，放入鹹蛋黃，蒜末，以中小火炒至起泡。，放回玉米筍，鹹蛋白拌炒，起鍋前灑上蔥花，辣椒，即可完成。。,玉米筍/425055_金沙玉米筍.jpg
458873,甜豆玉米筍,https://icook.tw/recipes/458873,玉米筍、甜豆、雪白菇、蒜末、鹽巴、胡椒粉、米酒,玉米筍200克 | 甜豆150克 | 雪白菇100克 | 蒜末20克 | 鹽巴1小匙 | 胡椒粉1小匙 | 米酒2大匙,食材 | ❶玉米筍斜切段，甜豆撕除粗絲纖維 | ❷ 將玉米筍、甜豆、雪白菇先川燙1分鐘瀝乾 | ❸炒鍋熱油炒香蒜末，再放入燙煮好的食材，大火翻炒均勻，簡單用鹽巴、胡椒粉、米酒調味後，翻炒均勻即可,甜豆玉米筍。食材：玉米筍200克，甜豆150克，雪白菇100克，蒜末20克，鹽巴1小匙，胡椒粉1小匙，米酒2大匙。做法：食材，❶玉米筍斜切段，甜豆撕除粗絲纖維，❷ 將玉米筍、甜豆、雪白菇先川燙1分鐘瀝乾，❸炒鍋熱油炒香蒜末，再放入燙煮好的食材，大火翻炒均勻，簡單用鹽巴、胡椒粉、米酒調味後，翻炒均勻即可。,玉米筍/458873_甜豆玉米筍.jpg
459943,炒甜椒玉米筍,https://icook.tw/recipes/459943,彩椒、玉米筍、橄欖油、鹽、蒜片/蒜末,彩椒3個 | 玉米筍8根 | 橄欖油適量 | 鹽適量 | 蒜片/蒜末適量,"彩椒、玉米筍洗乾淨後切成塊狀。 | 油鍋加入蒜片或蒜末拌炒。
加入蔬菜拌炒。
加入些許的水，蓋上鍋蓋燜煮3分鐘。
加鹽調味即可。","炒甜椒玉米筍。食材：彩椒3個，玉米筍8根，橄欖油適量，鹽適量，蒜片/蒜末適量。做法：彩椒、玉米筍洗乾淨後切成塊狀。，油鍋加入蒜片或蒜末拌炒。
加入蔬菜拌炒。
加入些許的水，蓋上鍋蓋燜煮3分鐘。
加鹽調味即可。。",玉米筍/459943_炒甜椒玉米筍.jpg
459954,玉米筍肉捲捲,https://icook.tw/recipes/459954,豬火鍋肉片、玉米筍、日式醬油、味霖、清水,豬火鍋肉片10 片 | 玉米筍10 根 | 日式醬油兩大匙 | 味霖兩大匙 | 清水四大匙,"準備食材
＊玉米筍需先入滾水中，川燙至熟成 | 豬肉片攤平，把玉米筍捲起 | 在平底鍋中加熱少許橄欖油，將捲好的玉米筍肉捲捲放入鍋中，煎至表面金黃色 | 煎好的玉米筍肉捲捲可以先取出 | 煮醬汁，日式醬油、味霖、清水煮滾，稍微收到有一點稠度，煮好的醬汁就可以淋在肉上，搭配享用
＊如有客人，可以把頭尾切除，這樣排盤更為美觀","玉米筍肉捲捲。食材：豬火鍋肉片10 片，玉米筍10 根，日式醬油兩大匙，味霖兩大匙，清水四大匙。做法：準備食材
＊玉米筍需先入滾水中，川燙至熟成，豬肉片攤平，把玉米筍捲起，在平底鍋中加熱少許橄欖油，將捲好的玉米筍肉捲捲放入鍋中，煎至表面金黃色，煎好的玉米筍肉捲捲可以先取出，煮醬汁，日式醬油、味霖、清水煮滾，稍微收到有一點稠度，煮好的醬汁就可以淋在肉上，搭配享用
＊如有客人，可以把頭尾切除，這樣排盤更為美觀。",玉米筍/459954_玉米筍肉捲捲.jpg
462373,焗烤馬鈴薯蝦仁毛豆玉米筍,https://icook.tw/recipes/462373,馬鈴薯、蝦仁、冷凍毛豆仁、玉米筍、乳酪絲,馬鈴薯2顆 | 蝦仁100克 | 冷凍毛豆仁1把 | 玉米筍1盒 | 乳酪絲適量,馬鈴薯洗淨削皮切塊、去除毛豆仁外膜並洗淨、玉米筍洗淨斜切備用。 | 將蝦仁、毛豆仁、玉米筍川燙後擺入烤盤中，時間分別為30秒、2分鐘、3分鐘。預熱烤箱，轉200度10分鐘。川燙馬鈴薯塊約8分鐘，擺入烤盤中，調整一下食材位置，均勻擺放。 | 鋪上適量的乳酪絲，盡量覆蓋到全部的食材。 | 送入烤箱，200度烤15分鐘，美味上桌囉！,焗烤馬鈴薯蝦仁毛豆玉米筍。食材：馬鈴薯2顆，蝦仁100克，冷凍毛豆仁1把，玉米筍1盒，乳酪絲適量。做法：馬鈴薯洗淨削皮切塊、去除毛豆仁外膜並洗淨、玉米筍洗淨斜切備用。，將蝦仁、毛豆仁、玉米筍川燙後擺入烤盤中，時間分別為30秒、2分鐘、3分鐘。預熱烤箱，轉200度10分鐘。川燙馬鈴薯塊約8分鐘，擺入烤盤中，調整一下食材位置，均勻擺放。，鋪上適量的乳酪絲，盡量覆蓋到全部的食材。，送入烤箱，200度烤15分鐘，美味上桌囉！。,玉米筍/462373_焗烤馬鈴薯蝦仁毛豆玉米筍.jpg
450223,玉米筍煎蛋,https://icook.tw/recipes/450223,玉米筍、蛋、調味,玉米筍1盒 | 蛋3顆 | 調味1小匙,"玉米筍洗淨後切小塊加入蛋液一起打散攪拌均勻
在加入一點調味粉 | 熱鍋加入適量的油，把攪拌好的食材下鍋煎
煎稍微焦香起鍋即可呈盤享用","玉米筍煎蛋。食材：玉米筍1盒，蛋3顆，調味1小匙。做法：玉米筍洗淨後切小塊加入蛋液一起打散攪拌均勻
在加入一點調味粉，熱鍋加入適量的油，把攪拌好的食材下鍋煎
煎稍微焦香起鍋即可呈盤享用。",玉米筍/450223_玉米筍煎蛋.jpg
453928,奶油蒜香玉米筍,https://icook.tw/recipes/453928,玉米筍、奶油、醬油、蒜頭、香菇素蠔油、鮮香菇、砂糖、金針菇,玉米筍25支 | 奶油適量 | 蒜頭3小瓣 | 鮮香菇5朵 | 金針菇0.5包 | 醬油1大匙 | 香菇素蠔油1大匙 | 砂糖1小匙,"1.玉米筍撥殼洗淨備用。
2.將蒜頭切成蒜末。（喜歡蒜味重可以用多一點蒜頭）
3.蔥可以切成蔥花或是蔥段，隨意。
4.將鮮香菇切成片備用。
5.金針菇根切除後，也是洗淨後備用。 | 1.取適量奶油入鍋，中小火即可，之後先加入蒜末拌炒，再將玉米筍、鮮香菇、金針菇入鍋一起拌炒。 | 1.加入一大匙香菇素蠔油及一大匙醬油。
2.加入一小匙的砂糖。
3.灑上蔥花。
4.起鍋，充滿奶油香的蔬食就完成囉！","奶油蒜香玉米筍。食材：玉米筍25支，奶油適量，蒜頭3小瓣，鮮香菇5朵，金針菇0.5包，醬油1大匙，香菇素蠔油1大匙，砂糖1小匙。做法：1.玉米筍撥殼洗淨備用。
2.將蒜頭切成蒜末。（喜歡蒜味重可以用多一點蒜頭）
3.蔥可以切成蔥花或是蔥段，隨意。
4.將鮮香菇切成片備用。
5.金針菇根切除後，也是洗淨後備用。，1.取適量奶油入鍋，中小火即可，之後先加入蒜末拌炒，再將玉米筍、鮮香菇、金針菇入鍋一起拌炒。，1.加入一大匙香菇素蠔油及一大匙醬油。
2.加入一小匙的砂糖。
3.灑上蔥花。
4.起鍋，充滿奶油香的蔬食就完成囉！。",玉米筍/453928_奶油蒜香玉米筍.jpg
450230,小黃瓜炒玉米筍,https://icook.tw/recipes/450230,小黃瓜、玉米筍、胡椒粒,小黃瓜1條 | 玉米筍6支 | 胡椒粒1小匙,全部炒一炒 加胡椒粒 就可出鍋,小黃瓜炒玉米筍。食材：小黃瓜1條，玉米筍6支，胡椒粒1小匙。做法：全部炒一炒 加胡椒粒 就可出鍋。,玉米筍/450230_小黃瓜炒玉米筍.jpg
443730,肉醬玉米筍,https://icook.tw/recipes/443730,玉米筍、肉醬罐頭、蔥花,玉米筍200克 | 肉醬罐頭1罐 | 蔥花10克,"食材 | ❶玉米筍洗淨擺盤
❷肉醬罐頭取適量肉醬鋪在玉米筍上 | ❸電鍋蒸煮，外鍋1杯水蒸熟後，撒點蔥花即可","肉醬玉米筍。食材：玉米筍200克，肉醬罐頭1罐，蔥花10克。做法：食材，❶玉米筍洗淨擺盤
❷肉醬罐頭取適量肉醬鋪在玉米筍上，❸電鍋蒸煮，外鍋1杯水蒸熟後，撒點蔥花即可。",玉米筍/443730_肉醬玉米筍.jpg
453743,金沙杏鮑菇玉米筍,https://icook.tw/recipes/453743,杏鮑菇、鹹蛋、蔥、蒜頭、糖,杏鮑菇8朵 | 鹹蛋2顆 | 蔥1根 | 蒜頭3瓣 | 糖1小匙,"杏鮑菇切塊，玉米筍斜切段。 | 蒜頭切末，蔥切末。 | 鹹蛋切對半，
用湯匙壓成泥，
蛋黃和蛋白混合。 | 大火熱油後，
放入爆蒜末、白蔥末、鹹蛋泥翻炒。 | 大火炒到鹹蛋香氣跑出來，
油起小油泡後。 | 放入杏鮑菇和玉米筍翻炒，
蓋上鍋蓋用小火燜煮，
直到杏鮑菇出水後，
放些許紅糖中火煎到表皮微焦黃。 | 起鍋前放綠蔥末攪拌，完成。","金沙杏鮑菇玉米筍。食材：杏鮑菇8朵，鹹蛋2顆，蔥1根，蒜頭3瓣，糖1小匙。做法：杏鮑菇切塊，玉米筍斜切段。，蒜頭切末，蔥切末。，鹹蛋切對半，
用湯匙壓成泥，
蛋黃和蛋白混合。，大火熱油後，
放入爆蒜末、白蔥末、鹹蛋泥翻炒。，大火炒到鹹蛋香氣跑出來，
油起小油泡後。，放入杏鮑菇和玉米筍翻炒，
蓋上鍋蓋用小火燜煮，
直到杏鮑菇出水後，
放些許紅糖中火煎到表皮微焦黃。，起鍋前放綠蔥末攪拌，完成。。",玉米筍/453743_金沙杏鮑菇玉米筍.jpg
450637,青江菜炒玉米筍 / 家常菜,https://icook.tw/recipes/450637,青江菜、玉米筍、蒜瓣、酪梨油、鹽,青江菜4棵 | 玉米筍10根 | 蒜瓣2~3瓣 | 酪梨油1小匙 | 鹽1/4小匙,"●朋友特別留給我去摘，記錄我人生第一次拔菜，感恩又開心。 | ●蓋網無灑藥的青江菜很乾淨，每顆沖洗洗淨，葉子跟肥厚的跟部熟成時間不同分開放。 | ●玉米筍爬山小農現剝的，洗淨每根斜切；蒜瓣洗過拍碎剝膜。 | ● 28吋平底鍋小火加油，先爆香蒜末，蒜香出現時先加鹽這樣炒菜鹽會比較均勻。 | ● 依熟成度擺放
先放玉米筍跟青江菜跟部翻炒後，設定計時器蓋鍋2分鐘。 | ● 2分鐘到打開鍋蓋拌炒，再把青江菜葉放進來拌炒1分鐘，就完成啦。 | 吃起來很清脆很甜美，感恩的心。","青江菜炒玉米筍 / 家常菜。食材：青江菜4棵，玉米筍10根，蒜瓣2~3瓣，酪梨油1小匙，鹽1/4小匙。做法：●朋友特別留給我去摘，記錄我人生第一次拔菜，感恩又開心。，●蓋網無灑藥的青江菜很乾淨，每顆沖洗洗淨，葉子跟肥厚的跟部熟成時間不同分開放。，●玉米筍爬山小農現剝的，洗淨每根斜切；蒜瓣洗過拍碎剝膜。，● 28吋平底鍋小火加油，先爆香蒜末，蒜香出現時先加鹽這樣炒菜鹽會比較均勻。，● 依熟成度擺放
先放玉米筍跟青江菜跟部翻炒後，設定計時器蓋鍋2分鐘。，● 2分鐘到打開鍋蓋拌炒，再把青江菜葉放進來拌炒1分鐘，就完成啦。，吃起來很清脆很甜美，感恩的心。。",玉米筍/450637_青江菜炒玉米筍___家常菜.jpg
438922,椒鹽玉米筍,https://icook.tw/recipes/438922,玉米筍、蒜頭、辣椒、蔥花、檸檬汁、鹽、白胡椒粉、花椒粉,玉米筍200 克 | 蒜頭2 粒 | 辣椒適量 | 蔥花1 枝 | 檸檬汁1 匙 | 鹽1/2 匙 | 白胡椒粉1/4 匙 | 花椒粉1/4 匙,"玉米筍對切 | 燒一鍋熱水放人1匙鹽拌勻，放入玉米筍拌煮至熟(6-8分鐘)
取出玉米筍瀝乾泡於冰水 | 取出玉米筍瀝乾放入碗中加入調味拌勻","椒鹽玉米筍。食材：玉米筍200 克，蒜頭2 粒，辣椒適量，蔥花1 枝，檸檬汁1 匙，鹽1/2 匙，白胡椒粉1/4 匙，花椒粉1/4 匙。做法：玉米筍對切，燒一鍋熱水放人1匙鹽拌勻，放入玉米筍拌煮至熟(6-8分鐘)
取出玉米筍瀝乾泡於冰水，取出玉米筍瀝乾放入碗中加入調味拌勻。",玉米筍/438922_椒鹽玉米筍.jpg
443670,甜不辣炒玉米筍,https://icook.tw/recipes/443670,甜不辣、玉米筍、鹽、小黃瓜、黑胡椒粒、紅蘿蔔、蒜頭,甜不辣2條 | 玉米筍5穗 | 小黃瓜1條 | 紅蘿蔔1/8條 | 蒜頭2瓣 | 鹽1/3茶匙 | 黑胡椒粒1/10茶匙,1.準備材料，清理與清洗之。 | 2.玉米筍切半，小黃瓜切半再斜切片，紅蘿蔔切片，蒜頭切片，甜不辣切斜片。 | 3.起鍋，開小火，加入2大匙食用油，放入甜不辣。 | 4.將甜不辣兩面煎至金黃上色後先起鍋。 | 5.再放入蒜片炒出香氣。 | 6.轉中小火，放入紅蘿蔔與玉米筍快速拌炒至轉透色。 | 7.再放入小黃瓜續炒至轉透綠色。 | 8.再加入調味料拌勻。 | 9.再把步驟4.甜不辣加入，拌勻即可關火。 | 10.起鍋盛盤。,甜不辣炒玉米筍。食材：甜不辣2條，玉米筍5穗，小黃瓜1條，紅蘿蔔1/8條，蒜頭2瓣，鹽1/3茶匙，黑胡椒粒1/10茶匙。做法：1.準備材料，清理與清洗之。，2.玉米筍切半，小黃瓜切半再斜切片，紅蘿蔔切片，蒜頭切片，甜不辣切斜片。，3.起鍋，開小火，加入2大匙食用油，放入甜不辣。，4.將甜不辣兩面煎至金黃上色後先起鍋。，5.再放入蒜片炒出香氣。，6.轉中小火，放入紅蘿蔔與玉米筍快速拌炒至轉透色。，7.再放入小黃瓜續炒至轉透綠色。，8.再加入調味料拌勻。，9.再把步驟4.甜不辣加入，拌勻即可關火。，10.起鍋盛盤。。,玉米筍/443670_甜不辣炒玉米筍.jpg
446534,蒜味奶油玉米筍,https://icook.tw/recipes/446534,玉米筍、金針菇、蔥、鹽、黑胡椒粒、奶油,玉米筍1盒 | 金針菇1包 | 蔥1支 | 鹽0.5小匙 | 黑胡椒粒1小匙 | 奶油20克,玉米筍洗淨，金針菇去尾洗淨，蔥切末. | 深盤中，放入金針菇，再放玉米筍，上面放奶油，蒜末，再灑上鹽與黑胡椒. | 電鍋外鍋，加一杯水，放入深盤，待電鍋跳起，表面灑上蔥末即可.,蒜味奶油玉米筍。食材：玉米筍1盒，金針菇1包，蔥1支，鹽0.5小匙，黑胡椒粒1小匙，奶油20克。做法：玉米筍洗淨，金針菇去尾洗淨，蔥切末.，深盤中，放入金針菇，再放玉米筍，上面放奶油，蒜末，再灑上鹽與黑胡椒.，電鍋外鍋，加一杯水，放入深盤，待電鍋跳起，表面灑上蔥末即可.。,玉米筍/446534_蒜味奶油玉米筍.jpg
444995,清蒸帶殼玉米筍,https://icook.tw/recipes/444995,帶殼玉米筍,帶殼玉米筍10支,帶殼玉米筍10支 | ❶玉米筍洗淨，可稍微剝除幾片葉子 | ❷玉米筍裝盤，放電鍋蒸煮，外鍋1杯水蒸熟 | ❸蒸熟後，剝除葉子即可食用,清蒸帶殼玉米筍。食材：帶殼玉米筍10支。做法：帶殼玉米筍10支，❶玉米筍洗淨，可稍微剝除幾片葉子，❷玉米筍裝盤，放電鍋蒸煮，外鍋1杯水蒸熟，❸蒸熟後，剝除葉子即可食用。,玉米筍/444995_清蒸帶殼玉米筍.jpg
448247,醬燒玉米筍小黃瓜,https://icook.tw/recipes/448247,玉米筍、小黃瓜、蝦子,玉米筍15根 | 小黃瓜2條 | 蝦子5隻,"黃瓜切片，跟玉米筍先炒，
加點水，滾一下。 | 等水收乾後，加入蝦子和烤肉醬，在加點水下去翻炒，等食物上色就可以起鍋了。","醬燒玉米筍小黃瓜。食材：玉米筍15根，小黃瓜2條，蝦子5隻。做法：黃瓜切片，跟玉米筍先炒，
加點水，滾一下。，等水收乾後，加入蝦子和烤肉醬，在加點水下去翻炒，等食物上色就可以起鍋了。。",玉米筍/448247_醬燒玉米筍小黃瓜.jpg
444937,芹菜玉米筍炒花枝,https://icook.tw/recipes/444937,花枝、芹菜、玉米筍、辣椒、鹽巴,花枝1隻 | 芹菜1把 | 玉米筍1盒 | 辣椒1根 | 鹽巴些許,芹菜切條、玉米筍切段、花枝切塊 | 熱油鍋下玉米筍與花枝中火拌炒 | 加入芹菜與辣椒些許水大火拌炒至食材軟化 | 待花枝熟透後即可盛盤,芹菜玉米筍炒花枝。食材：花枝1隻，芹菜1把，玉米筍1盒，辣椒1根，鹽巴些許。做法：芹菜切條、玉米筍切段、花枝切塊，熱油鍋下玉米筍與花枝中火拌炒，加入芹菜與辣椒些許水大火拌炒至食材軟化，待花枝熟透後即可盛盤。,玉米筍/444937_芹菜玉米筍炒花枝.jpg
448614,蒜香金針菇玉米筍,https://icook.tw/recipes/448614,玉米筍、金針菇、醬油、蒜頭、青蔥、辣椒、香油,玉米筍150g | 金針菇1包 | 蒜頭5瓣 | 青蔥1根 | 辣椒0.5~1條 | 香油1/2茶匙 | 醬油1大匙,1.準備所有食材，清理與清洗之；青蔥切蔥花；蒜頭切末；辣椒切圓片(不吃辣可去籽或不加)；金針菇去蒂頭，撥撕為一小束一小束。。 | 2.取一盤，先擺入金針菇，再擺上玉米筍。 | 3.再放上蒜末與辣椒。 | 4.加入調味料醬油即可。 | 5.爐火以中大火蒸12分鐘即可。(或用傳統電鍋：外鍋0.5米杯水，跳起即可，或蒸氣烤箱:溫度:100℃ | 15分鐘)。 | 6.完成後取出，再撒上蔥花，淋上香油即可上桌。,蒜香金針菇玉米筍。食材：玉米筍150g，金針菇1包，蒜頭5瓣，青蔥1根，辣椒0.5~1條，香油1/2茶匙，醬油1大匙。做法：1.準備所有食材，清理與清洗之；青蔥切蔥花；蒜頭切末；辣椒切圓片(不吃辣可去籽或不加)；金針菇去蒂頭，撥撕為一小束一小束。。，2.取一盤，先擺入金針菇，再擺上玉米筍。，3.再放上蒜末與辣椒。，4.加入調味料醬油即可。，5.爐火以中大火蒸12分鐘即可。(或用傳統電鍋：外鍋0.5米杯水，跳起即可，或蒸氣烤箱:溫度:100℃，15分鐘)。，6.完成後取出，再撒上蔥花，淋上香油即可上桌。。,玉米筍/448614_蒜香金針菇玉米筍.jpg
441509,玉米筍四季豆肉醬,https://icook.tw/recipes/441509,豬絞肉、四季豆、玉米筍、杏鮑菇、蒜頭、薑,豬絞肉1碗 | 四季豆1把 | 玉米筍8根 | 杏鮑菇1條 | 蒜頭5顆 | 薑1小塊,"玉米筍.杏鮑菇,四季豆切丁 ，薑蒜切細末 | 油炒蒜薑和絞肉,炒肉至半熟加蔬菜丁,加1湯匙醬油,糖半湯匙,味啉2茶匙,胡椒粉1茶匙,水半湯匙,炒勻至食材全熟湯汁收亁,完成。","玉米筍四季豆肉醬。食材：豬絞肉1碗，四季豆1把，玉米筍8根，杏鮑菇1條，蒜頭5顆，薑1小塊。做法：玉米筍.杏鮑菇,四季豆切丁 ，薑蒜切細末，油炒蒜薑和絞肉,炒肉至半熟加蔬菜丁,加1湯匙醬油,糖半湯匙,味啉2茶匙,胡椒粉1茶匙,水半湯匙,炒勻至食材全熟湯汁收亁,完成。。",玉米筍/441509_玉米筍四季豆肉醬.jpg
